{
  "spec_version": "retrieval/0.1",
  "match_kind": "exact_signature",
  "rank_score_bps": 10000,
  "signals": [
    {
      "kind": "exact_signature",
      "contribution_bps": 10000,
      "detail": "exact match on signature operation/v2|shell|cargo build"
    },
    {
      "kind": "recency",
      "contribution_bps": 0,
      "detail": "occurred_at 2026-07-12T00:00:00Z breaks ties within a tier (newer first)"
    }
  ],
  "applied_filters": [],
  "tie_break": "rank_score_bps descending (exact-signature matches outrank full-text-only matches); within full-text matches, bm25 ascending; then occurred_at descending (recency); then event_id ascending"
}
